{
  "arms": [
    {
      "case_id": "2d28afa05ca75718",
      "cell_id": "e141_i0.06324555",
      "grid_delta": 0.0025,
      "movement": {
        "cd_bottom": {
          "absolute_delta": 0.005156533863278523,
          "fine_repeat_max": 0.3261940481308431,
          "fine_repeat_min": 0.3239500518350336,
          "inside_observed_fine_repeat_range": false,
          "reference_value": 0.3239500518350336,
          "signed_delta": -0.005156533863278523,
          "value": 0.3187935179717551
        },
        "cd_middle": {
          "absolute_delta": 0.000845345261292485,
          "fine_repeat_max": 0.325505150435093,
          "fine_repeat_min": 0.3227480676919807,
          "inside_observed_fine_repeat_range": true,
          "reference_value": 0.3227480676919807,
          "signed_delta": 0.000845345261292485,
          "value": 0.3235934129532732
        },
        "cd_top": {
          "absolute_delta": 0.001921945500961919,
          "fine_repeat_max": 0.3313346023335526,
          "fine_repeat_min": 0.33092273661105076,
          "inside_observed_fine_repeat_range": false,
          "reference_value": 0.3310803137650578,
          "signed_delta": -0.001921945500961919,
          "value": 0.3291583682640959
        },
        "depth": {
          "absolute_delta": 0.009746973480461607,
          "fine_repeat_max": 1.2492273956772588,
          "fine_repeat_min": 1.24122317125564,
          "inside_observed_fine_repeat_range": false,
          "reference_value": 1.2489277093454347,
          "signed_delta": 0.009746973480461607,
          "value": 1.2586746828258963
        },
        "max_bow": {
          "absolute_delta": 0.003411260138713512,
          "fine_repeat_max": 0.006810454100524971,
          "fine_repeat_min": 0.005473720626635814,
          "inside_observed_fine_repeat_range": false,
          "reference_value": 0.005473720626635814,
          "signed_delta": 0.003411260138713512,
          "value": 0.008884980765349326
        },
        "scallop_rms": {
          "absolute_delta": 0.00010456090377569324,
          "fine_repeat_max": 0.002335986070174763,
          "fine_repeat_min": 0.0022060569344643306,
          "inside_observed_fine_repeat_range": false,
          "reference_value": 0.0022060569344643306,
          "signed_delta": -0.00010456090377569324,
          "value": 0.0021014960306886374
        },
        "sidewall_angle_deg": {
          "absolute_delta": 0.0964697105063759,
          "fine_repeat_max": 0.2222342126862393,
          "fine_repeat_min": 0.14458713621363523,
          "inside_observed_fine_repeat_range": false,
          "reference_value": 0.21807077099013925,
          "signed_delta": 0.0964697105063759,
          "value": 0.31454048149651515
        }
      },
      "profile": {
        "current": {
          "available": true,
          "point_count": 76,
          "width_order_widest_to_narrowest": [
            "cd_top",
            "cd_middle",
            "cd_bottom"
          ]
        },
        "reference": {
          "available": true,
          "point_count": 76,
          "width_order_widest_to_narrowest": [
            "cd_top",
            "cd_bottom",
            "cd_middle"
          ]
        },
        "width_order_preserved": false
      },
      "rng_seed": 950273,
      "runtime": {
        "current_elapsed_s": 196.2680380344391,
        "interpretation": "raw wall time from the recorded machine and execution contexts; not a causal or general benchmark",
        "reference_elapsed_s": 981.9464218616486,
        "reference_over_current_ratio": 5.003088794770276
      }
    },
    {
      "case_id": "494968a8af2bdb59",
      "cell_id": "e141_i0.06324555",
      "grid_delta": 0.005,
      "movement": {
        "cd_bottom": {
          "absolute_delta": 0.002836120572474732,
          "fine_repeat_max": 0.3261940481308431,
          "fine_repeat_min": 0.3239500518350336,
          "inside_observed_fine_repeat_range": false,
          "reference_value": 0.3239500518350336,
          "signed_delta": -0.002836120572474732,
          "value": 0.3211139312625589
        },
        "cd_middle": {
          "absolute_delta": 0.009595214721064727,
          "fine_repeat_max": 0.325505150435093,
          "fine_repeat_min": 0.3227480676919807,
          "inside_observed_fine_repeat_range": false,
          "reference_value": 0.3227480676919807,
          "signed_delta": 0.009595214721064727,
          "value": 0.33234328241304545
        },
        "cd_top": {
          "absolute_delta": 0.007560191069030164,
          "fine_repeat_max": 0.3313346023335526,
          "fine_repeat_min": 0.33092273661105076,
          "inside_observed_fine_repeat_range": false,
          "reference_value": 0.3310803137650578,
          "signed_delta": -0.007560191069030164,
          "value": 0.32352012269602765
        },
        "depth": {
          "absolute_delta": 0.019108872151867073,
          "fine_repeat_max": 1.2492273956772588,
          "fine_repeat_min": 1.24122317125564,
          "inside_observed_fine_repeat_range": false,
          "reference_value": 1.2489277093454347,
          "signed_delta": 0.019108872151867073,
          "value": 1.2680365814973018
        },
        "max_bow": {
          "absolute_delta": 0.002548965754583271,
          "fine_repeat_max": 0.006810454100524971,
          "fine_repeat_min": 0.005473720626635814,
          "inside_observed_fine_repeat_range": false,
          "reference_value": 0.005473720626635814,
          "signed_delta": 0.002548965754583271,
          "value": 0.008022686381219085
        },
        "scallop_rms": {
          "absolute_delta": 4.5413842660868824e-05,
          "fine_repeat_max": 0.002335986070174763,
          "fine_repeat_min": 0.0022060569344643306,
          "inside_observed_fine_repeat_range": false,
          "reference_value": 0.0022060569344643306,
          "signed_delta": -4.5413842660868824e-05,
          "value": 0.002160643091803462
        },
        "sidewall_angle_deg": {
          "absolute_delta": 0.1455888766419417,
          "fine_repeat_max": 0.2222342126862393,
          "fine_repeat_min": 0.14458713621363523,
          "inside_observed_fine_repeat_range": false,
          "reference_value": 0.21807077099013925,
          "signed_delta": -0.1455888766419417,
          "value": 0.07248189434819753
        }
      },
      "profile": {
        "current": {
          "available": true,
          "point_count": 76,
          "width_order_widest_to_narrowest": [
            "cd_middle",
            "cd_top",
            "cd_bottom"
          ]
        },
        "reference": {
          "available": true,
          "point_count": 76,
          "width_order_widest_to_narrowest": [
            "cd_top",
            "cd_bottom",
            "cd_middle"
          ]
        },
        "width_order_preserved": false
      },
      "rng_seed": 950273,
      "runtime": {
        "current_elapsed_s": 48.54822397232056,
        "interpretation": "raw wall time from the recorded machine and execution contexts; not a causal or general benchmark",
        "reference_elapsed_s": 981.9464218616486,
        "reference_over_current_ratio": 20.22620688290263
      }
    },
    {
      "case_id": "42896640bba58b61",
      "cell_id": "e50_i0.04",
      "grid_delta": 0.0025,
      "movement": {
        "cd_bottom": {
          "absolute_delta": 0.0021274049065653222,
          "fine_repeat_max": 0.3238236270421728,
          "fine_repeat_min": 0.317956768964584,
          "inside_observed_fine_repeat_range": true,
          "reference_value": 0.317956768964584,
          "signed_delta": 0.0021274049065653222,
          "value": 0.32008417387114935
        },
        "cd_middle": {
          "absolute_delta": 0.0016166387550853867,
          "fine_repeat_max": 0.32889778804335734,
          "fine_repeat_min": 0.32211364689442734,
          "inside_observed_fine_repeat_range": false,
          "reference_value": 0.32889778804335734,
          "signed_delta": 0.0016166387550853867,
          "value": 0.33051442679844273
        },
        "cd_top": {
          "absolute_delta": 0.0011931471294801543,
          "fine_repeat_max": 0.33166273025468007,
          "fine_repeat_min": 0.3307794483862439,
          "inside_observed_fine_repeat_range": false,
          "reference_value": 0.3307794483862439,
          "signed_delta": -0.0011931471294801543,
          "value": 0.32958630125676375
        },
        "depth": {
          "absolute_delta": 0.0030422102287570585,
          "fine_repeat_max": 1.2532833034440678,
          "fine_repeat_min": 1.247665456193101,
          "inside_observed_fine_repeat_range": true,
          "reference_value": 1.247665456193101,
          "signed_delta": 0.0030422102287570585,
          "value": 1.2507076664218582
        },
        "max_bow": {
          "absolute_delta": 0.002149493391528895,
          "fine_repeat_max": 0.013611961836445557,
          "fine_repeat_min": 0.007940120939260498,
          "inside_observed_fine_repeat_range": false,
          "reference_value": 0.007940120939260498,
          "signed_delta": -0.002149493391528895,
          "value": 0.005790627547731603
        },
        "scallop_rms": {
          "absolute_delta": 0.000710813961189874,
          "fine_repeat_max": 0.0035756045497144684,
          "fine_repeat_min": 0.002513088216546205,
          "inside_observed_fine_repeat_range": false,
          "reference_value": 0.002513088216546205,
          "signed_delta": -0.000710813961189874,
          "value": 0.0018022742553563311
        },
        "sidewall_angle_deg": {
          "absolute_delta": 0.10236239507937384,
          "fine_repeat_max": 0.39255924642599926,
          "fine_repeat_min": 0.23891641246917333,
          "inside_observed_fine_repeat_range": true,
          "reference_value": 0.39255924642599926,
          "signed_delta": -0.10236239507937384,
          "value": 0.29019685134662543
        }
      },